Шторы, 1 520 R, Шторы по самым выгодным ценам.\n\nПокупайте в рассрочку без процентов или в кредит! \n\nШторы Виват.\n\nМатериал: Имитация рогожки, портьерная ткань, 100% полиэстер.\n\nЗатемнение: Среднее.\n\nПлотная портьерная ткань с имитацией рогожки, плотное плетение ткани позволяет ткани выглядеть объемной. Лицевая сторона матовая, а изнаночная глянцевая.\n\nРазмеры (цена указана за одно полотно готового изделия): \n\n130х270см = 1520 руб. \n\n150х270см = 1720 руб. \n\n180х270см = 2010 руб. \n\n200х270см = 2220 руб. \n\n220х270см = 2460 руб. \n\n240х270см = 2650 руб. \n\n270х270см = 2980 руб. \n\n300х270см = 3280 руб. \n\nИзготовим шторы в любых необходимых Вам размерах индивидуально! \n\nПричины Приобрести Шторы У Нас: \n\nНизкая цена. Мы являемся производителем\xa0— Вы сэкономите до 40% стоимости. \n\nОтличное качество. В производстве используем только качественные и экологически безопасные материалы, надежную фурнитуру и работаем на профессиональном оборудовании. \n\nБесплатная доставка от 8000 рублей! (распространяется на Цфо РФ).\n\nДоставка во все города наложенным платежом, Без Предоплаты.\n\nБесплатная Консультация специалиста в подборе текстиля под Ваш интерьер! \n\nШвеи с 10-летним опытом работы\xa0— от квалификации мастера напрямую зависит качество продукции! \n\nСобственный магазин «Зенит»\xa0— по адресу ул. Навагинская д. 7.\n\nБолее 500 видов и расцветок штор. \n\nОплата производится при получении продукции, после осмотра изделия. Возможна оплата наличными, банковскими картами, либо по безналичной форме оплаты. \n\nРаботаем круглосуточно. Пишите и звоните\xa0— ответим на все интересующие вопросы и не только:).\n\nШторы, Купить шторы, ikea, Занавески, Гардины, Evrika Home, Портьеры, рулонные шторы, карнизы +для штор, тюль, шторы +на окна, магазин штор, Шторы москва, шторы тюль, цветные шторы, ткань, блэкаут, димаут.
Шторы, 1 720 R, Шторы по самым выгодным ценам.\n\nПокупайте в рассрочку без процентов или в кредит! \n\nШторы Мадрид.\n\nЦвет: Каштан.\n\nМатериал: Портьерный деним, полиэстер 100%.\n\nЗатемнение: Среднее.\n\nПортьерный деним\xa0— ткань саржевого переплетения, лицевая стороны соткана из меланжевых нитей, изнаночная стороны гладкая глянцевая. Устойчивы к выцветанию, структура ткани трехслойная (между лицом и изнанкой вплетена черная сатиновая нить) которая позволяет хорошо затемнять помещение, исходя из основного цвета ткани.\n\nРазмеры (цена указана за одно полотно готового изделия): \n\n130х270см = 1720 руб. \n\n150х270см = 1950 руб. \n\n180х270см = 2280 руб. \n\n200х270см = 2510 руб. \n\n220х270см = 2770 руб. \n\n240х270см = 2990 руб. \n\n270х270см = 3360 руб. \n\n300х270см = 3700 руб. \n\nИзготовим шторы в любых необходимых Вам размерах индивидуально! \n\nПричины Приобрести Шторы У Нас: \n\nНизкая цена. Мы являемся производителем\xa0— Вы сэкономите до 40% стоимости. \n\nОтличное качество. В производстве используем только качественные и экологически безопасные материалы, надежную фурнитуру и работаем на профессиональном оборудовании. \n\nБесплатная доставка от 8000 рублей! (распространяется на Цфо РФ).\n\nДоставка во все города наложенным платежом, Без Предоплаты.\n\nБесплатная Консультация специалиста в подборе текстиля под Ваш интерьер! \n\nШвеи с 10-летним опытом работы\xa0— от квалификации мастера напрямую зависит качество продукции! \n\nСобственный магазин «Зенит»\xa0— по адресу ул. Навагинская д. 7.\n\nБолее 500 видов и расцветок штор. \n\nОплата производится при получении продукции, после осмотра изделия. Возможна оплата наличными, банковскими картами, либо по безналичной форме оплаты. \n\nРаботаем круглосуточно. Пишите и звоните\xa0— ответим на все интересующие вопросы и не только:).\n\nШторы, Купить шторы, ikea, Занавески, Гардины, Evrika Home, Портьеры, рулонные шторы, карнизы +для штор, тюль, шторы +на окна, магазин штор, Шторы москва, шторы тюль, цветные шторы, ткань, блэкаут.
Шторы, 1 540 R, Шторы по самым выгодным ценам.\n\nПокупайте в рассрочку без процентов или в кредит! \n\nШторы Аврора.\n\nЦвет: Светлая бирюза.\n\nМатериал: трехслойная, светонепроницаемая ткань Димаут, 100% полиэстер.\n\nЗатемнение: 65-90%.\n\nЭто трехслойная светонепроницаемая ткань, способная блокировать 65-90% светового потока, за поглощение лучей отвечает черная нить (светофильтр) вплетенная между лицом и изнанкой. Лицевая сторона полуглянцевая с металлическим блеском, изнаночная сторона контрастная по цвету, матовая. \n\nРазмеры (цена указана за одно полотно готового изделия): \n\n130х270см = 1540 руб. \n\n150х270см = 1730 руб. \n\n180х270см = 2020 руб. \n\n200х270см = 2230 руб. \n\n220х270см = 2460 руб. \n\n240х270см = 2660 руб. \n\n270х270см = 2990 руб. \n\n300х270см = 3280 руб. \n\nИзготовим шторы в любых необходимых Вам размерах индивидуально! \n\nПричины Приобрести Шторы У Нас: \n\nНизкая цена. Мы являемся производителем\xa0— Вы сэкономите до 40% стоимости. \n\nОтличное качество. В производстве используем только качественные и экологически безопасные материалы, надежную фурнитуру и работаем на профессиональном оборудовании. \n\nБесплатная доставка от 8000 рублей! (распространяется на Цфо РФ).\n\nДоставка во все города наложенным платежом, Без Предоплаты.\n\nБесплатная Консультация специалиста в подборе текстиля под Ваш интерьер! \n\nШвеи с 10-летним опытом работы\xa0— от квалификации мастера напрямую зависит качество продукции! \n\nСобственный магазин «Зенит»\xa0— по адресу ул. Навагинская д. 7.\n\nБолее 500 видов и расцветок штор. \n\nОплата производится при получении продукции, после осмотра изделия. Возможна оплата наличными, банковскими картами, либо по безналичной форме оплаты. \n\nРаботаем круглосуточно. Пишите и звоните\xa0— ответим на все интересующие вопросы и не только:).\n\nШторы, Купить шторы, ikea, Занавески, Гардины, Evrika Home, Портьеры, рулонные шторы, карнизы +для штор, тюль, шторы +на окна, магазин штор, Шторы москва, шторы тюль, цветные шторы, ткань, блэкаут, димаут.
Шторы, 1 500 R, Шторы по самым выгодным ценам.\n\nПокупайте в рассрочку без процентов или в кредит! \n\nШторы Марсель.\n\nЦвет: сирень и фиолетовый.\n\nМатериал: Трехслойная, светонепроницаемая ткань димаут, 100% полиэстер.\n\nЗатемнение: 65-90%.\n\nЭто трехслойная светонепроницаемая ткань, способная блокировать 65-90% светового потока, за поглощение лучей отвечает черная нить (светофильтр) вплетенная между лицом и изнанкой. Лицевая и изнаночная стороны гладкокрашеные матовые. \n\nСредней плотности. \n\nРазмеры (цена указана за одно полотно готового изделия): \n\n130х270см = 1500 руб. \n\n150х270см = 1690 руб. \n\n180х270см = 1970 руб. \n\n200х270см = 2170 руб. \n\n220х270см = 2400 руб. \n\n240х270см = 2590 руб. \n\n270х270см = 2910 руб. \n\n300х270см = 3190 руб. \n\nИзготовим шторы в любых необходимых Вам размерах индивидуально! \n\nПричины Приобрести Шторы У Нас: \n\nНизкая цена. Мы являемся производителем\xa0— Вы сэкономите до 40% стоимости. \n\nОтличное качество. В производстве используем только качественные и экологически безопасные материалы, надежную фурнитуру и работаем на профессиональном оборудовании. \n\nГарантия качества. Товар можно вернуть в течении 10-ти дней. \n\nБесплатная доставка от 8000 рублей! (распространяется на Цфо РФ).\n\nДоставка во все города наложенным платежом, Без Предоплаты.\n\nБесплатная Консультация специалиста в подборе текстиля под Ваш интерьер! \n\nШвеи с 10-летним опытом работы\xa0— от квалификации мастера напрямую зависит качество продукции! \n\nСобственный магазин «Зенит»\xa0— по адресу ул. Навагинская д. 7.\n\nБолее 500 видов и расцветок штор и тюль. \n\nОплата производится при получении продукции, после осмотра изделия. Возможна оплата наличными, банковскими картами, либо по безналичной форме оплаты. \n\nРаботаем круглосуточно. Пишите и звоните\xa0— ответим на все интересующие вопросы и не только:).\n\nШторы, Купить шторы, ikea, Занавески, Гардины, Evrika Home, Портьеры, рулонные шторы, карнизы +для штор, тюль, шторы +на окна, магазин штор, Шторы москва, шторы тюль, цветные шторы, ткань, блэкаут.
Шторы, 14 000 R, Продам дизайнерские шторы состоящие из 2х частей в идеальном состоянии. Шили на заказ. \nПричина продажи, меняем интерьер. \nБольшое полотно 4м ширина и 2м 54см высота. \nУзкое полотно 1м 10см ширина. \n\nЦена: 14000р.\nШили за 25000р.
Шторы, 5 000 R, Комплект: ночные шторы и покрывало. Пошив Мир штор.
Шторы бу, 5 000 R, Продам шторы отличного качества. Тюль\xa0— 2 полотна по 188см(длина)х232см(ширина). Портьера\xa0— 124см. Тюль с цветным узором\xa0— 103см. Ламбрекен на липучке, крепится к потолку, его ширина 35см. Высота потолка -2,50 м, ширина стены 3,42 м.
Шторы, 1 540 R, В наличии одна. Плотная. Не капризная ткань. Для стандартных потолков в Дск домах. Почти новая. Из за переезда.
Шторы, 1 720 R, Штора с кольцами в ванную новая. 200 на 180 размер.
Шторы, 1 500 R, Продаю шторы размер 255х260 (собраны на 155) -2шт.
Шторы тюль, 350 R, Плотные шторы! Ширина 3м каждая по 1,5м. И 4м по 2м-2200р. \nВысота 2.70м. Без Тюли! Производство Беларусь. Расцветок много. Все в наличие! Цену на эти шторы можете посмотреть в интернете, а моя цена…1900р. Возможна подшивка 200р. \nКоличество ограничено. Первые 4 фото реальные! \nИ добро пожаловать в профиль.
